{
  "schema_version": 1,
  "id": "mem-4ea11faf9a805993cfa05a7f354f9f59",
  "scope": "shared",
  "kind": "preference",
  "title": "Offline local models and readable files",
  "body": "The owner wants to use local AI models and human-readable files offline. Keep the memory repository usable without a network connection and independent of a specific model runtime.",
  "status": "active",
  "classification": "internal",
  "confidence": 1.0,
  "tags": [
    "offline",
    "local",
    "models",
    "memory",
    "setup"
  ],
  "sources": [
    {
      "ref": "shared/sources/initial-request.md",
      "excerpt": "Local AI models and readable files"
    }
  ],
  "created_at": "2026-09-27T12:09:23+00:00",
  "updated_at": "2026-09-27T12:09:23+00:00",
  "review_after": "2027-03-26T12:09:23+00:00",
  "expires_at": null,
  "supersedes": [],
  "history": [
    {
      "at": "2026-09-27T12:09:23+00:00",
      "actor": "repository-bootstrap",
      "action": "create",
      "reason": "Captured as a draft for review."
    },
    {
      "at": "2026-09-27T12:09:23+00:00",
      "actor": "repository-bootstrap",
      "action": "activate",
      "reason": "Directly grounded in the owner's explicit setup request; no additional personal facts inferred."
    }
  ]
}
